{
  "document": {
    "id": "guide-action-pipeline",
    "title": "액션 파이프라인",
    "source_path": "ko/guide/action-pipeline.md",
    "category": "guide"
  },
  "priority": {
    "score": 85,
    "tier": "essential"
  },
  "extraction": {
    "strategy": "concept-first",
    "character_limits": {
      "100": {
        "focus": "파이프라인 기본 개념"
      },
      "200": {
        "focus": "파이프라인 실행 흐름"
      },
      "300": {
        "focus": "파이프라인 구조와 제어"
      },
      "400": {
        "focus": "완전한 파이프라인 사용법"
      }
    }
  },
  "work_status": {
    "source_modified": "2025-08-14T21:08:19.296Z",
    "generated_files": {
      "100": {
        "path": "/Users/junwoobang/project/context-action/packages/llms-generator/data/ko/guide-action-pipeline/guide-action-pipeline-100.txt",
        "created": "2025-08-14T21:15:25.129Z",
        "modified": "2025-08-14T21:30:02.556Z",
        "edited": true,
        "needs_update": false
      },
      "300": {
        "path": "/Users/junwoobang/project/context-action/packages/llms-generator/data/ko/guide-action-pipeline/guide-action-pipeline-300.txt",
        "created": "2025-08-14T21:30:02.556Z",
        "modified": "2025-08-14T21:30:02.556Z",
        "edited": false,
        "needs_update": false
      },
      "1000": {
        "path": "/Users/junwoobang/project/context-action/packages/llms-generator/data/ko/guide-action-pipeline/guide-action-pipeline-1000.txt",
        "created": "2025-08-15T16:35:32.070Z",
        "modified": "2025-08-15T16:35:32.070Z",
        "edited": false,
        "needs_update": true
      },
      "2000": {
        "path": "/Users/junwoobang/project/context-action/packages/llms-generator/data/ko/guide-action-pipeline/guide-action-pipeline-2000.txt",
        "created": "2025-08-15T16:35:32.070Z",
        "modified": "2025-08-15T16:35:32.070Z",
        "edited": false,
        "needs_update": true
      }
    },
    "last_checked": "2025-08-15T16:35:32.070Z"
  }
}